,text,labels
0,The development of the covid-19 vaccine hinged on accelerated timelines ― and hyperconverged infrastructure from Nutanix AHV helped to make that possible for one Contract Research Organization.  http  http,2
1,I voted for Not a chance. Too many unknowns about risks/side effects - Poll: Should kids (aged 6 months to 5 years old) be getting the COVID-19 vaccine?  http,0
2,Scientists and medical experts worked to ensure the #vaccine is safe for children and adolescents ages 6mo to 17yo.   To find #COVID-19 vaccines for kids:  ❓ Check with your child’s doctor 🔍 Visit  http 💬 text your ZIP code to 438829 📞 Call 1-800-232-0233  http,1
3,Ontario hospitals plan to uphold COVID-19 vaccine policies amid 'crisis' staffing shortages  http via @user via @user #onpoli,1
4,"@user Dillon Quirke had heart problems for years, before the COVID-19 vaccines were invented. In 2018, Quirke took a break from hurling after he contracted viral myocarditis.",0
5,"CDC Claims Link Between Heart Inflammation and COVID-19 Vaccines Wasn’t Known for Most of 2021  ""CDC officials made the claim, which is false, in response to a Freedom of Information Act request""  http",0
6,@user @user @user 40% of the people who have died since covid-19 vaccines started have been vaxxed!,1
7,Health Care Workers Who Sued Over COVID-19 Vaccine Mandate Win $10 Million Settlement  http via @user,1
8,"COVID-19 threat looms as Butler County cases trend upward  -- News, Social Impact | The Perfect Enemy:  http  #Vaccines",2
9,"RT @user The #COVIDVaccines authorized by @user are safe and effective. They protect you, your family, and your community from COVID-19. More info about vaccines for #Indigenous Peoples:  ➡️  http  http",2
10,"The long-awaited authorization of COVID-19 vaccines for children under age 5 finally arrived on June 17th. As of 7/29/22, over a month later, only 4.1% of kids ages 0-4 in New York State have received at least one dose.  We need to educate parents, and vax with greater urgency.  http",0
11,$NVAX – The drugmaker’s stock plummeted 32.3% in the premarket after posting an unexpected quarterly loss and cutting its full-year revenue guidance in half. Novavax said it did not expect any further U.S. sales of its Covid-19 vaccine this year amid soft demand and a supply glut,0
12,"To qualify as a fully vaccinated traveller to Canada, an individual must have received their second dose of a COVID-19 vaccine at least 14 days prior to entering Canada.  #NovakDjokovic #NB022   http",2
13," http According to Fact Blockers, ""All COVID-19 vaccines were tested on animals and there were no safety concerns....at the time.""",0
14,@user Covid 19 vaccine,2
15,"@user @user Le GVT maintient les personnels suspendus et s'oppose ainsi à la justice et à la raison. ➡️La justice, car ces soignants sont maintenus sans aucune ressource. ➡️La raison, car un non-vacciné n'ayant pas le #COVID est moins dangereux qu'un soignant vacciné ayant le #Covid_19",2
16,"Johns Hopkins Coronavirus Resource Center reports on Thursday that there were 313,724 doses of Covid-19 vaccine administered. That's about average for the past two weeks.  Johns Hopkins reports that there were 1,032,820 deaths in the United States.",1
17,"Facilities in Non-Hispanic Black, Rural Counties Less Likely to Administer Early COVID-19 Vaccines - Pharmacy Times  http",1
18,How does the flu vaccine affect the risk of contracting COVID-19?  http,1
19,"COVID-19 update for Aug. 8: Airlines and railways exempted 1,700 travellers from vaccine requirement | Thousands stranded in China resort city amid lockdown  http",1
20,"@user @user I don’t know how help you understand or where you do for your information but the vaccine was not about prevention of infection. It was about reducing your chances of dying from COVID-19. If you were told differently, you were lied to",1
21,Lukewarm interest in COVID-19 vaccine for kids under 5  http,2
22,Does your 6 month to 5 year old need a #COVID vaccine? The #KidsComeFirst #COVID-19 Vaccine Clinic is here for you!   Visit our website to learn more and pre-register now:  http #CovidIsNotOver  http,2
23,"CDC statement, ""protection from the Pfizer and Moderna COVID-19 vaccines starts to fade around 4 months after a booster""... yet the gov is pushing this on babies to protect them for a short time!!! And then what 30 shots by age 10? WAKE UP PARENTS!!! #vaccineinjuries #FauciLied",0
24,"Covid-19 Vaccination Sites:  ✅ Alachua 🚨 Tuesday, August 9  ✅ Hawthorne 🚨 Wednesday, August 10  ✅ Jacksonville 🚨 Saturday, August 13  (See locations and hours below)  #COVID19 #Vaccines #Boosters #Alachua #Hawthorne #Jacksonville #Florida",2
25,"What use are you on health matters? still silent! @user @user @user @user @user @user   UK Medicine Regulator confirms COVID-19 Vaccines are at least a shocking 7,402% deadlier than all other Vaccines combined  http",0
26,"COVID-19 UPDATE  206.21 crore total vaccine doses (93.55 cr Second Dose and 10.59 cr Precaution Dose) have been administered so far    29,58,617 doses administered in last 24 hours  India's active caseload currently stands at 1,34,933  Active cases stand at 0.31%  http",1
27,"Effective September 21st, our vaccine clinics will only be offering the Moderna Covid-19 vaccine.   Please note: There may be limited supply of Pfizer and J&amp;J as we make this transition.   Visit  http for locations nearest you, if you'd like other vaccines.  http",2
28,About 67% migrant &amp; refugee women relied on media for obtaining  information about COVID-19 vaccines while only 17% accessed information via health care providers. #BreakingtheBarriers report reflects cracks in the healthcare system in Victoria. Read more  http  http,0
29,"@user @user LMAO! More people died from covid-19 in Biden's Presidency then Trump's &amp; he had the Vaccine, explain that.",2
30,White House officials say scientists at the nation's top health agencies are looking into expanding vaccine eligibility so that more Americans can get a second booster shot during the latest COVID-19 wave. Agencies weigh 2nd COVID booster for more people; admin urges shots for...  http,2
31,"The #OakPark Health Dept. is hosting a COVID-19 vaccine clinic for children ages 6 months and older. The clinic is set for 4 to 7 p.m. on Tuesday, Aug. 9 at Cheney Mansion. Visit  http to register for an appointment.  http",1
32,"@user @user @user ""MYTH: Researchers rushed the development of the COVID-19 vaccine, so its effectiveness and safety cannot be trusted.""  http",0
33,EXCLUSIVE: CDC Claims Link Between Heart Inflammation and COVID-19 Vaccines Wasn’t Known for Most of 2021   http,2
34,"@user @user @user Birx Admits She Knew COVID-19 Vaccines Were Never ""Going To Protect Against Infection""   http  http",0
35,"Congress:  Useless Covid 19 Vaccines? We have the funding to make that free &amp; as often as CDC says for anyone who wants one, hell let's pay folks to get it.  Also Congress: Need life saving insulin because you are diabetic &amp; poor/low/no income?  Good luck btch socialism is evil.",2
36,"@user 0% of people need a covid-19 vaccine, now that even  your own data shows it DOES NOTHING.  Time to get off the gravy train and dump the vaccines.",0
37,"It's rime for the back to school shots. ""Malita says some of the required vaccinations teens need to receive are against meningitis and tetanus.  The Health Department is also offering the COVID-19 vaccine. ""   http Nuff said. God Bless America, God Save The Rep",2
38,"“Parents are having their say about the Covid-19 vaccines for children under 5, and for most, the answer so far is no.”  http",2
39,@user @user @user They spent money on COVID-19 and thank god they did.  Got us the vaccine mandate meds in record time.  That’s the reason these bozos can say they’ve reduced the deficit.  Of course they did..we spent trillions to fight the virus.  They spend billion to ….hire irs agents,0
40,DANS LA FAMILLE FABIUS VOUS AVEZ LE PERE  covid-19-vaccine-deployment-risks-mckinseyTélécharger Impressionnant ce schéma qui détaille le schéma opérationnel commun aux différentes entités pour délivrer les vaccins.   http Victor Fabius co-auteur de Comment,1
41,"Currently one of the most talked about vaccines, here are some facts about the COVID-19 vaccine as provided by the COVID-19 Public Education Campaign.   #ivax2protec  http",1
42,3Ktv News Headlines today.   SINOVAC COVID-19 Vaccine for Children Above 6 Months of Age   #DStv293 #3KtvNews #TheBestOfZimbabwe  http,2
43,Novavax Inc on Monday halved its full-year revenue forecast as it does not expect further sales of its COVID-19 shot this year in the United States in the face of a global supply glut and soft demand. #news #blnnetwork #businesslivenews #bln #Novavax #vaccine #glutes  http,0
44,"@user @user Caused by covid 19 or the vaccines? 680 Australians died last week with covid , ironically with a 90% double dose vaccination rate. The vax is a 🍋  Stop the hysteria Stop the vaccines",2
45,@user They said it maybe the covid 19 vaccine,2
46,"COVID-Related Stillbirths Didn’t Have to Happen. A lack of testing data &amp; government guidance led many to avoid the COVID-19 vaccine during pregnancy, unwittingly increasing their chances of a stillbirth. w comments from Ruth Faden @user | ProPublica  http",2
47,Novavax Covid-19 vaccine should carry warning for possible heart side-effects    http,2
48,Illinois hospital system to pay $10.3 million in settlement with workers over COVID-19 vaccine mandate  http,1
49,@user I did however 100% agree with their leaders stance on forced covid 19 vaccines. That issue  was something I’d stand by them on regardless.,1
50,Misrepresentation of Germany’s Data on Unverified COVID-19 Vaccine Side Effects  http,0
51,"August is National Immunization Month!  The summer is winding down and school is around the corner, we encourage you to stay informed on vaccinations. Visit the CDC website to learn more about the COVID-19 vaccine.  http",2
52,Liars. 😡  EXCLUSIVE: CDC Claims Link Between Heart Inflammation and COVID-19 Vaccines Wasn’t Known for Most of 2021  http,0
53,"College students, return to campus confidently and safely! Get vaccinated and boosted against COVID-19 before fall semester starts. To find a vaccine, visit  http  http",1
54,EMA recommends Novavax add warning to their COVID-19 vaccine - The Jerusalem Post  http,2
55,"More than 196.89 cr COVID-19 vaccine doses provided to States, UTs, Health News, ET HealthWorld  http",2
56,"Why K-12 schools aren’t requiring students to get Covid-19 #Vaccines  -- News, Social Impact | The Perfect Enemy:  http  #Adolescents #Black #Hispanic #PublicHealth  http",0
57,Today's Newswire: (Washington Examiner) Fed-up Fauci says he's over people who won't 'adhere' to COVID-19 rules  This Moderna Phase 3 Vaccine Trials volunteer is fed up with Anthony Fauci.,0
58,South Africa Confirms First Death ‘Causally Linked’ to COVID-19 Vaccine  http,1
59,"@user (1/3) Health Canada received a submission from Pfizer-BioNTech seeking authorization for the use of its Comirnaty COVID-19 vaccine as a booster dose in children 5 to 11 years of age on May 27, 2022. Health Canada reviews vaccine applications through an independent process and ...",1
60,"Stop all mdm fckr vaxx no vax repeat not even one is effective. All is about killing story!  Spikevax (previously COVID-19 Vaccine Moderna, mRNA)  http",0
61,Open Access UCL Research: A positive update on COVID-19 booster vaccine willingness among Danes  http,2
62,Should you get another Covid-19 vaccine booster now or wait for the new shots?  http  http,2
63,"""Parental COVID-19 Vaccine Hesitancy in the United States - Jeanette B. Ruiz, Robert A. Bell, 2022""  http 草",2
64,@user @user ...and that's a wRap!  Read @user explainer thread on the country's COVID-19 vaccine wastage here.  http,1
65,"More than 80,000 Durham residents have received 2nd COVID-19 vaccine booster. @user @user    http  http",2
66,@user How many of the 9 confirmed and 46 probable cases have received at least one covid-19 vaccine shot?,1
67,"74.2 million people in the USA have not had a single dose of a Covid-19 Vaccine, &amp; another 157 million have refused a 2nd or 3rd dose according to CDC – The Expose  http",2
68,A doctor who was banned from Twitter for posting about COVID-19 vaccines is willing to serve as the ... (Latest news at  http  http,1
69,"""All COVID-19 vaccines authorized in Canada are proven safe, effective and of high quality.""  Except that's not entirely correct if you read the fine print or the testimony of the official who authorizes vaccines in Canada. 1/  http",1
70,@user @user First Song : Omo Ope ft Olamide  Second Song: Sungba Third Song: Sungba ft Burna Boy  Fourth Song: PBUY Fifth Song: Terminator (Leaked)  Just 4 official songs and you say he's bigger? Tuennnnn... Patapaa over Asake on any day 🤣🤣🤣  I'm a huge fan tho,2
71,Twitter Threatened With Class-Action Lawsuit for Banning Doctor Over COVID-19 Vaccine Post   http,0
72,"Even before the COVID-19 vaccine was authorized, there was a plan to discredit it  http",0
73,Health Ministry to use mobile vaccination sites or vehicles to administer the fourth dose of COVID-19 vaccine.  http #LKA #SriLanka @user,1
74,"Note they drive a #Vaxxed bus around NSW/QLD, purportedly interviewing endless “vaccine injured” devotees. Set out to gather COVID-19 vaccine victim testimonies last year. Where is this evidence? #StopAVN",0
75,Breaking news in green bay. Packers QB Aaron Rodgers is getting suspended for 6 games for not being vaccine against covid 19 packers back up QB Jordan Love will start for the 6 games. Per me &amp; @user   #GreenBay #GreenBayPackers,0
76,EC’s HERA signs Covid-19 vaccine procurement deal with HIPRA  http  The HIPRA bivalent recombinant protein Covid-19 vaccine is presently under the EMA’s rolling review.  http,2
77,"Military wife Crystal Kupper: ""When the Secretary of Defense ordered all military members to get the Covid-19 shot, I knew that my man never would."" Exclusive—Crystal Kupper: My Military Husband Isn’t Backing Down from the Vaccine Mandate and Neither Am I  http",1
78,"Covid-19 : Seuls 11,46 % des Sénégalais ciblés vaccinés  http",2
79,"@user Key Information for Travelers to Costa Rica  Make sure you are up to date with your COVID-19 vaccines before traveling to Costa Rica. If you are not up to date with your COVID-19 vaccines, avoid travel to Costa Rica. Even if you are up to date with your COVID-19 vaccines,",0
80,@user @user,1
81,I typically agree @user but you’re flat wrong on healthcare because any child attending public schools has a whole list of Required Vaccinations.   COVID-19 was evolving and those who insisted on balking at vaccine and mask requirements had the highest death rates.,1
82,Year 2018  .  COVID 19 VACCINE ASTRAZENECA MANUFATURED DATE IS 2018  .   http,0
83,Lukewarm interest in COVID-19 vaccine for kids under 5  http,2
84,@user @user Thalidomide? That’s not a vaccine. It was used OVER 50 YEARS AGO. Ever heard of •Chickenpox (varicella) •Cholera. •COVID-19. •Diphtheria. •Haemophilus influenzae type b (Hib) •Hepatitis A. •Hepatitis B. •Human papillomavirus. Vaccines can prevent them.,0
85,Pfizer and BioNTech will begin trials of their updated mRNA Covid-19 vaccine designed to protect against the newer BA.4 and BA.5 sub-variants of the coronavirus later this month.  http,0
86,"Protect yourself and your loved ones by ensuring that you complete the recommended dose of the COVID-19 vaccine.    Chanjwa! Pata Chanjo, tuwe Chonjo!  #Chanjwa #TuweChonjo  @user @user @user @user  http",2
87,"@user @user @user @user @user @user @user @user @user @user @user @user @user @user @user @user @user @user @user @user @user @user @user Looks @user bravely ran away.  Folks should feel to report anymore misinformation they peddle on ivermectin, COVID-19 vaccines, etc., since they're violating Twitter's terms of service.   http   http  http",1
88,@user Vaccines are effective #COVID protection from severe illness  Unvaccinated are ~40 times more likely to be hospitalized  For additional #Covid_19 information from medical professionals   http  not partisan trumpers  #CovidVaccine,2
89,"You know how they say we're an unclean minority? There are 74.2 million of us, natural pure human1.0.   #JustSayNo to the #Transhumanist gene editing experiment known as the mRNA COVID-19 vaccines.",0
90,Tous ceux qui ont la Covid-19 sont vaccinés et tous ceux qui sont décédés...  http,2
91,"@user @user @user @user @user @user @user @user @user @user @user ""BansOffOurBodies"" - Dems are hypocrites - covid-19 vaccine.",1
92,"BioNTech and Pfizer will start a clinical trial of a Covid-19 vaccine adapted to the BA.4 and BA.5 variants of Omicron this month, as the German biotech forecasts an increase in demand at the end of the year.   http @user @user",2
93,"Nearly 30,000 Deaths Reported To VAERS  Data released by the CDC show 1,371,474 reports of adverse events from all age groups following COVID-19 vaccines, including 29,981 deaths and 249,116 serious injuries between Dec. 14, 2020, and July 29, 2022.  http",1
94,"@user @user The data says that virtually 100% of us will get COVID 19. Indeed, vaccines mitigate but do not eliminate the risks of increasing age and obesity. One can live in a bubble... forever.... or roll the dice... even for those at high risk , the odds are in your favour.",2
95,🚨 COVID-19 VACCINE CLINICS: Aug 9  – Aug 14 🚨 💉PFIZER and MODERNA  💉Ages 5+ are welcome (unless otherwise specified) 💉3rd doses available for 12+ 💉4th doses available for those eligible  💉Walk-in only (unless otherwise specified)   http @user  http,1
96,"🚍The vaccination bus is coming...  🚏Catch it in Hanley on Saturday 6 August. Remember, it's never too late to get your first, second or booster dose of the Covid-19 vaccine  📅Sat 6 Aug ⏰10.30am - 4.30pm 📍Tontine Square, nr Halifax, ST1 1NP  🚶No need to book, just turn up  http",1
97,@user @user I think there is a conflict between Covid-19 and Monkeypox vaccine.,0
98,"(From Dr MA lone) “I was speaking with a friend yesterday, and she was so saddened by her family’s rejection of her over her critical perspective concerning the COVID-19 policies/vaccines. She is just one of many, many people suffering from being isolated and rejected",0
99,"@user Hi Doug. I am an essential worker in healthcare and my comp manufactures vaccines for Covid 19 and tirelessly worked in 2020 -21. I know that this administration prioritizes esntl wrkrs. Our EB3 cases from Oct 2020 mvd to NBC on Jun 7th 22 and stuck, didn’t move to FO",2
100,"BREAKING: A federal judge in Ohio has blocked the military’s COVID-19 vaccine mandate nationwide for Air Force, Space Force and Air National Guard service members who requested religious exemptions.",0
101,"🚨BREAKING: COVID 19 Vaccine Mandate Dropped🚨  It has been a long time in the waiting for cruisers, but @user has now officially outdone @user @user and @user (All who allow limited unvaccinated passengers).   http 1/",1
102,"@user @user Honored @user ‘s Dr. Daniela Díaz who spearheaded the Covid-19 vaccine efforts at the Armory and thanks to her work, over 100,000 folks got their vaccines!  You represent us well 🇩🇴🇩🇴  http",2
103,"Australia scraps COVID-19 vaccine that produced HIV false positives | World News, The Indian Express  http",0
104,@user @user,1
105,"The US made hundreds of millions of doses of safe &amp; effective COVID-19 vaccines available by early 2021, but by early summer, US production of COVID-19 vaccine doses mostly stopped growing. Why?  @user explains:  http  http",2
106,@user @user @user I've received many vaccines and yes I know how they work. That's why the Covid 19 vaccines aren't real vaccines. That's why they've changed the definition of vaccines in the last two years. They're moving the goal posts to fit their narrative. How much did Pfizer make on vaccines,2
107,"Vaccine Rollout (2nd dose 5+)  1,404 2nd doses administered yesterday 90.03% nationwide  By state: NSW: 89.28% VIC: 89.27% QLD: 85.70% WA: 91.72% SA: 88.68% TAS: 94.39% ACT: 98.11% NT: 82.18%",2
108,"74.2 million people in the USA have not had a single dose of a Covid-19 Vaccine, &amp; another 157 million have refused a 2nd or 3rd dose according to CDC – The Expose  http",2
109,"@user @user Followed. These vaccines will soon surpass any other deaths recorded in history. Be sure to follow back, I post a lot on COVID-19 injuries.",2
110,"""COVID-19 'Vaccine' Mandates Will Apparently Be Permanently Ended In Costa Rica. This message was just released on Telegram. I have not been able to confirm anything via the news…""Dr. Byram W. Bridle  http",1
111,How Johnson &amp; Johnson’s Secure Data Pipeline Helped Speed the COVID-19 Vaccine Production  http,2
112,What can I say to get banned the quickest hmm. Hate this platform bunch of communist running it. You cant change your gender! The covid 19 vaccine doest work very well and is pointless for most people take. LGBTQ movement protects groomers that want to sexualize kids.,0
113,EU says Novavax Covid-19 vaccine should carry heart side-effect warning  http,2
114,"Stay up to date on your COVID-19 vaccine and booster shots.   Use this tool to determine when or if you (or your child) can get one or more COVID-19 boosters. Visit  http and click the ""Find Out When to Get a Booster"" button to start.",1
115,"Animal studies were completed for the COVID-19 vaccines, contrary to a Texas lawmaker’s false claim. A clip of his 2021 remarks is once again being shared widely online.  http",2
116,Getting vaccinated and boosted against #COVID19 are two of the best and safest ways to protect yourself and others.  The initial series of your COVID-19 vaccine is as important as your booster shot.  Schedule your vaccine or booster shot appointment! ☎️312-942-3368 #getthevax  http,2
117,"UofT's decision to require those living in student residences to have at least three doses of a COVID-19 vaccine could boost third-dose uptake among young adults, but it won't drive a significant increase unless other schools follow suit, experts say.   http",2
118,Parental COVID-19 Vaccine Hesitancy in the United States.  http,1
119,"@user From the same Health Canada report: “Although adverse events may occur after being vaccinated with a COVID-19 vaccine, they are not necessarily related to the vaccine.”",0
120,"@user @user @user As far as charging individuals a fee before getting vaccinated, ""COVID-19 vaccines are available for everyone ages 6 months and older at no cost. Vaccines were paid for with taxpayer dollars and will be given free of charge to all people living in the United States...""",1
121,"Prior CDC-imposed barriers to off-label Covid-19 vaccine access that @user &amp; I have written about should no longer apply.   Yet we still aren't seeing off-label talked about as an option to get at-risk but ineligible folks access, though it should be!   http",0
122,#Covid_19 @user #vaccine #vaccineinjuries #VaccineSideEffects #VaccineDeaths  @user @user  #EUA #SuddenAdultDeathSyndrome  @user @user Still can't sue.  This is just so sad.  #myocarditis Kids have an almost 100% recovery rate. #Parents,0
123,Sick and tired of the same shit. There is no such thing as a vaccine for covid 19. Its fake news.,0
124,"Whit Merrifield gets COVID-19 vaccine, now able to play in home Blue Jays games  http",2
125,"@user @user @user It does say that.  ""A two-dose series of the vaccine was 100% effective against Covid-19""",2
126,"To date, the health regulator assessed around 160 people who “possibly died” after getting the jab. South Africa Confirms Causal Link Between Death and COVID-19 Vaccine  http",1
127,"The U.S. government will pay $1.74 billion to buy 66 million doses of #Moderna’s #COVID-19 vaccine made with the new #Omicron-adapted formula, the drugmaker said.  MORE ON THIS HERE:  http  #Vaccine #mRNA #Variants",1
128,"It's a shame  COVID-19 Vaccines Hinder the Immune System, Lead to More Severe Illness: Dr. Robert Malone  http via @user",0
129,"Whit Merrifield gets COVID-19 vaccine, now able to play in home Blue Jays games  http",2
130,@user @user @user Covid 19 vaccine results🤣😂😹,1
131,"Wish me luck!!   For more inclusive approach in combating unequal access to affordable, good quality, and safe COVID-19 vaccines.  http",1
132,"@user @user @user @user Like what qanon king? Election fraud debunked! cabal of Satanic, cannibalistic sexual abusers of children operating a global child sex trafficking ring debunked! Jan 6th were ANTIFA, debunked! Bill Gates puts chips in COVID-19 vaccine debunked and stupid.",0
133,@user You can’t cry about that bc we are forced to vaccinated in schools not just Covid-19. College require some vaccines too or at least one if your in the dorm rooms. So miss me the crying about the Covid-19 vaccine.,2
134,Children between 6 months and 5 years old can now get the COVID-19 vaccine in this province.  We asked psychologist Janine Hubbard for advice for parents of young kids who might be nervous about giving them the shot   http  #cbcnl,1
135,"@user West Virginia will not let students attend school who don't have mandatory vaccines, which unfortunately does not include influenza or covid-19.   Which is why my kid is forced to homeschool.  He had cystic fibrosis.   Hmmm.",1
136,Should you get another Covid-19 vaccine booster now or wait for the new shots?  http via @user,2
137,New2Trip: Serum sickness-like reaction to COVID-19 vaccine  http,2
138,"The Red and Amber Code function, as part of the ""Vaccine Pass"", will enable arrivals tested Covid-19 negative to go out and about sooner while minimising the risk level of transmission in community.   http  http  http",1
