,text,labels
1064,"Parents are having their say about the Covid-19 vaccines for children under 5, and for most, the answer so far is no  http via @user",2
1065,China was also the single largest Covid-19 vaccine provider to other countries and regions in the world in the billions last year when most tended to hoard the vaccines for themselves.,1
1066,The reason you were bombarded with COVID-19 vaccines and the cause of instabilities in Afraka.,2
1067,"Just proves how well the mandated vaccine and boosters really work.  Biden tests positive for COVID-19 again, will continue White House isolation   http",2
1068,The UK Government has revealed that 1 in every 246 people vaccinated against Covid-19 in England has died within 60 days of receiving a dose of the Covid-19 vaccine.   http,1
1069,"Biden's COVID-19 response coordinator Dr. @user speaks with #TheView on the U.S. response to monkeypox.  ""I believe we can [eliminate this virus from the country], and we're going to do it with the tools we have: Testing, treatments and vaccines.""  http  http",2
1070,"@user Fauci admits that COVID-19 Vaccines do not protect 'overly well' against infections  The White House Chief Medical Adviser Dr. Anthony Fauci conceded that COVID-19 vaccines do not protect ""overly well"" against infections  http #FoxNews",0
1071,"Can’t believe this needs to be said but here we are.   The COVID-19 vaccines CANNOT and DO NOT cause MONKEYPOX. You CANNOT contract Monkeypox from them. It is biologically IMPOSSIBLE. Monkeypox is an orthopoxvirus- it has NOTHING to do with COVID. Please, stop the misinformation.",0
1072,"Moins de 60 ans, en bonne santé, vacciné et boosté ? “Vous êtes plutôt bien placé” avec le Covid-19  http",1
1073,"UK Medicine Regulator Confirms COVID-19 Vaccines are at Least a Shocking 7,402% Deadlier than all other Vaccines Combined  http",0
1074,"@user Since Covid-19 vax was brought up. What’s the point of getting a vaccine that neither keeps you from getting Covid or infecting other with Covid, especially when covid-19 has a 1% mortality rate? Hepatitis B has a mortality rate 19%. I don’t see people losing their shit over HB.",1
1075,Need to show proof of vaccination? How to store a COVID-19 vaccine card on your smartphone  http via @user,1
1076,"🇪🇪 COVID-19 vaccines in #Estonia - 09 Aug 2022 💉💉 Fully vaccinated: 844,120 (+85) | 63.5% 💉 At least 1 dose: 864,875 (+82) | 65.1%  ⏳ Time until 70% vaccinated (at least 1 dose) with last 7 days' pace: 1011 days (16 May 2025)",1
1077,Meet the scientists who created the first open-source COVID-19 vaccine  http #DeSci #OpenScience,1
1078,@user More than 40% of parents of young kids won’t get their child a COVID-19 vaccine  http,1
1079,Full debate | Carole Malone and Beverley Turner CLASH over Covid-19 Vaccine  http via @user,0
1080,@user @user,1
1081,"I just posted ""UK Medicine Regulator Confirms COVID-19 Vaccines are 7,402% Deadlier than all other Vaccines Combined"" on Reddit   http",0
1082,"South Africa's health regulator reported on Thursday a causal link between the death of an individual and Johnson &amp; Johnson's (J&amp;J) (JNJ.N) COVID-19 vaccine, the first time such a direct link has been made in the country.  http",1
1083,"""The study findings showed that four COVID-19 mRNA vaccine doses did not efficiently neutralize the SARS-CoV-2 Omicron BA.5 sublineage""  Maybe five doses will work?   http",2
1084,NEWS  South Africa Confirms First Death ‘Causally Linked’ to COVID-19 Vaccine   http,1
1085,EXCLUSIVE: CDC Claims Link Between Heart Inflammation and COVID-19 Vaccines Wasn’t Known for Most of 2021  http,2
1086,Commission signs joint procurement contract with HIPRA for COVID-19 vaccines  http #Business  http #news 512,2
1087,Twitter Threatened With Class-Action Lawsuit for Banning Doctor Over COVID-19 Vaccine Post  http via @user,0
1088,B.C. COVID-19 dashboard removes outcomes by vaccine status | CTV News #SmartNews   http,1
1089,"@user @user @user @user ""Pfizer and BioNTech Conclude Phase 3 Study of COVID-19 Vaccine Candidate, Meeting All Primary Efficacy Endpoints"" How was your education so horrible that you didn't even understand the meaning of the word experiment? Screenshots are for liars.",0
1090,Mag-ingat sa pekeng COVID-19 vaccines! #TeamPRO8 #PNPPatrolPlan2030 #WeServeAndProtect #PNPKakampiMo #PilipinasMuna  http,1
1091,"@user @user OSHA - that was an attempt to keep public workspaces safe. Employer-based vaccine mandates are not new, and they weren't when COVID-19 hit. I had to stay vaccinated when I worked in a hospital long before COVID-19.",0
1092,"""#Reflexiones de mis #alumnos (#TEVDAdeVerano)"":   http  #COVID19 #Covid_19 #COVIDー19 #Contagios #Positivos #Covid #Ukraine #Russia #ToqueDeQueda #Pfizer #UkraineRussiaWar @user #Vacunas #Vaccines #Coronavirus #FelizViernesATodos #13Rosas #FelizFinde  http",1
1093,Linking COVID-19 vaccine Monkeypox: Busting The Myths  http,2
1094,@user is the best Covid 19 vaccine  Even 4 doses of mRNA vaccines wasn't enough!   http,0
1095,"@user  @user @user @user @user @user Respected sir, My son Ishank Gupta was inoculated Covovax ( COVID 19) Vaccine 1st dose on 29 June 22. His 2nd dose is due now which is not available in delhi and ncr. I am searching from last 9 days.",1
1096,@user @user Anyone looked into vaccine effectiveness? 1000 Peer Reviewed Studies Questioning Covid-19 Vaccine Safety   http,2
1097,"🚨🚨🚨🚨🚨🚨🚨🚨🚨🚨🚨🚨🚨  BREAKING: A federal judge in Ohio has blocked the military’s COVID-19 vaccine mandate nationwide for Air Force, Space Force and Air National Guard service members who requested religious exemptions.",0
1098,Experts discuss COVID-19 vaccine hesitancy among parents of young children  http,1
1099,"""Pfizer and BioNTech will begin trials of their updated mRNA Covid-19 vaccine designed to protect against the newer BA.4 and BA.5 sub-variants of the coronavirus later this month.  http",0
1100,@user lots of confusion going on with vaccine requirements on your web site. Do you have to have the COVID-19 vaccine for a cruise leaving New Orleans in Nov if you’re over 12?,0
1101,📢📢📢REMINDER: The City of Vineland Health Department will be giving out COVID-19 vaccines and boosters TODAY at Rock of Salvation (513 E. Grape St) from 11:30 am until 1:30 pm! Hope to see you there! Have a great day! 😁  http,1
1102,@user You should have as many jobs as you have vaccine shots,1
1103,"@user @user @user @user @user Le vécu autour de moi indique tout le contraire de ce que vous affirmez. Perso, j'ai vu les dégâts que provoquait la covid-19 chez ceux qui n'étaient pas vaccinés et cela plus les publications scientifiques, ça m'a largement convaincu de me faire vacciner.",1
1104,"$NVAX shares plummet amid slow demand for its COVID-19 vaccines, while $GDRX shares soar after resolving disputes in its grocery store deal. @user explains:  http",2
1105,Youth team of #HITAY is engaged in COVID-19 Booster Immunization Program. We are setting Vaccine Points in various colleges and public places.  @user @user @user @user @user @user @user @user @user @user,1
1106,Vaccines can protect you from the harmful effects of the Covid-19 virus during this pandemic. Cyber insurance does just that in the case of a malware attack. Learn more-  http  http,2
1107,"For her big donation to help fund COVID-19 vaccine research, #DollyParton is a recipient of this year’s Carnegie Medal of Philanthropy. Read what Parton has to say about the incredible honor on our blog.  http #MusicNews #News",0
1108,FDA Approval of COVID-19 Vaccines for Infants and Young Children Is ‘Egregious’: Dr. Mercola   http,1
1109,"The European Medicines Agency has started a rolling review of a variant-adapted COVID-19 vaccine from Pfizer (PFE.N) and BioNTech, it said on Tuesday.  http",2
1110,"""Unvaccinated women who contracted COVID-19 during pregnancy were at a higher risk of stillbirths, more likely to be admitted to the ICU, give birth prematurely or die. Yet their greatest protection — the COVID-19 vaccine — sat largely untouched...""   http",1
1111,Dormant Virus Reactivation - COVID-19 vaccines update 53  http via @user,2
1112,"""Now that more than 258.1M total doses of the COVID-19 vaccine &amp; an estimated 40M flu vaccinations seasonally dispensed at retail pharmacies, U.S. consumers have grown accustomed to/very comfortable w/idea of receiving health svcs @ their local pharmacies""  http",1
1113,@user @user There are therapeutic vaccines which covid 19 is one. The idea is to lesson the symptoms so has not to be hospitalised so you just deal with it like flu.,1
1114,"As many Washington counties fall back into the CDC’s “lowest” risk for #COVID 19 category, there’s also a noticeable drop in the number of people receiving vaccine boosters.  Details on @user Listen live at AM 1000 &amp; 97.7 FM and online.",2
1115,@user @user Exactly! #MikePence was aware that #AnthonyFauci #DeborahBirx we’re lying to the American people about COVID-19 and the vaccines!! he was in on the takedown of the President of the United States!,0
1116,EXCLUSIVE: Epoch Times legt valse claim van het CDC bloot.👉CDC Claims Link Between Heart Inflammation and COVID-19 Vaccines Wasn’t Known for Most of 2021  http,0
1117,"How does @user  feel about being fact checked like this?                       “NEJM study on COVID-19 vaccines is taken out of context, fact-checkers report”   http",2
1118,"CTV news reports that Canada's British Columbia public health removes COVID vaccine data: ""BCCDC removes data on COVID-19 infection outcomes by vaccination status from dashboard""; WHY? Think!!!!  http",1
1119,Subacute thyroiditis after the third dose of the COVID-19 mRNA vaccine. Case report  http,2
1120,"@user @user @user I'm definitely not laughing about the millions who have died of Covid-19, it's absolutely tragic. If you're scared, don't take the vaccine and let us responsible, thinking citizens do the important work.  http",0
1121,"State Rep Jacob's stance on Covid-19 vaccine mandates?  You guessed it, ""Governmental tyranny!""  My body, my choice.   http",2
1122,"As of 4pm today, Cambridge is reporting: 1 newly reported COVID-19 case. 0 newly reported COVID-19 deaths. 17.2 cases per 100,000 residents, 7-day moving average. 90% of residents with at least one vaccine dose and 73% fully vaccinated. More at  http #CambMA  http",1
1123,#DYK age recommendations have changed to get COVID-19 vaccines and boosters?   It’s important to keep up with the new vaccine &amp; booster eligibilities to keep you &amp; your family safe. Help prevent the spread &amp; get your family members vaccinated.   For more:  http  http,2
1124,"@user I have found out the hard way, if you say anything about the vaccine, or covid-19 that does not fit the narrative. You will be blackballed from social media..",0
1125,"@user Ummm no..... covid-19 is nothing more than a flu. The flu virus has taken lives in the past. Nothing new here.  The vaccines can cause lifelong disabilities, or death.  Long covid is a myth perpetuated by hypochondriacs.",0
1126,"@user No, I think we shouldn't care about Covid 19 anymore.  It was a severe disease at the beginning since it killed many people, but not now. The government must not force people to get vaccines or give disadvantages to people depending on their vaccinated history or visit history.",1
1127,"The CDC recommends everyone 6 months and older be vaccinated against COVID-19.     If you are unsure if the vaccine is right for your children, talk with their pediatrician for the best advice. Learn more:  http  http",1
1128,Patiently waiting for those of us who took the Covid-19 vaccines to turn into zombies when WHO activates the zombie mood and bite those who didn’t take the vaccine.,2
1129,"@user @user @user @user I mean. Do you people even read your “citations”?  Literally the sub heading. 🤦🏽‍♂️🤦🏽‍♂️🤦🏽‍♂️. “Analysis Finds Partisanship Matters More than Age, Race, Education or Insurance Status in Predicting Whether Someone Received a COVID-19 Vaccine”. I honestly feel bad for you. Goodnight bud.",1
1130,While you were distracted by Boris resigning the UK Government published indisputable evidence that the Covid-19 Vaccines are deadly and are killing people in the Thousands: Mortality Rates are lowest among the Unvaccinated in all Age Groups  http,2
1131,BioNTech Sinks As Covid-19 Vaccine Sales And Profit Disappoint #SocialMedia #digital #digitalhealth #health via  http  http,0
1132,"Someone should create an impenetrable barrier between Luke O'Neill &amp; the Public.   All he says is emphatically untrue.  ""All the covid vaccines are 100 percent safe &amp; effective"" is but one lie.  How he has the audacity to show his face is beyond me. #Covid_19 #vaccineinjuries  http",0
1133,"Washington, DC Child COVID-19 Vaccine Mandate Illegal: Legal Expert  http",0
1134,@user @user Look what they are doing in Australia. On Australian Gov website about Intentional Release of GMO in environment. Look at Directive 184 -'Commercial supply of a genetically modified COVID-19 vaccine into environment'  Status:  Current.  http,2
1135,"This may help explain why the people who have received several COVID-19 vaccine boosters are increasingly the ones who end up in the hospital with severe COVID-19 symptoms, sometimes resulting in death, said scientist and physician Dr. Robert Malone.",2
1136,Children six months to four years now eligible for COVID-19 vaccine. Read the full story at  http  http,1
1137,"To those of you who are jabbed up and support the CDC, how do feel about the fact that the CDC: ""never conducted a mandated data mining analysis on reported ADVERSE EFFECTS that followed the administration of COVID-19 vaccine doses."" ⁉️⁉️⁉️  http",1
1138,"Get vaccinated, stay protected👍   COVID-19 vaccine clinic at Salford Royal Mayo Building today❗  ✔️8.30am to 6.30pm ✔️Eligibility from 5 years plus 👉🏻 5 to 11 years must book online   ✔️Walk-in or book at  http  Visit  http for more clinics.  http",1
1139,Post-vaccination infection rates and modification of COVID-19 symptoms in vaccinated UK school-aged children and adolescents: A prospective longitudinal cohort study #postvaccinationinfections #postvaccinationinfectionsinschoolchildren  #covid19 #vaccines  http,2
1140,No evidence the Pfizer COVID-19 vaccine is connected to the monkeypox outbreak  http via @user,0
1141,"@user In Mexico, our health authorities have always told us that COVID-19 vaccines will not prevent you from getting infected, but they will prevent you from getting seriously ill, and its totally true.",0
1142,In today's Media Digest: #InhaledVaccine for COVID-19 — The pandemic accelerated decades of research leading to jab-free vaccine now in human testing  @user   http,2
1143,NorthShore University Health to pay $10.3 million in COVID-19 vaccine lawsuit - CBS Chicago hmmmm  http,1
1144,DYK @user offers vaccination clinics 6 days this week?  COVID-19 vaccines are: ✅ Safe ✅ Available to ALL family members ages 6 months and up ✅ Able to minimize the severity of illness should a vaccinated person get COVID ✅ Free   http  http,2
1145,"@user ""The Pfizer/BioNTech and Moderna COVID-19 vaccines have received full approval by the Food and Drug Administration (FDA).""  http",2
1146,"Parents are having their say about the Covid-19 vaccines for children under 5, and for most, the answer so far is no  http",0
1147,The NBA informed teams today that players still need to either have received a primary course of a COVID-19 vaccine or been given a medical clearance from getting one in order to play games in Canada.   (via @user  http,1
1148,"@user @user @user @user @user @user @user @user @user @user @user Quite telling that @user provides better reporting on #Covid_19 vaccines than Apoorva Mandavilli at the NY Times. Apoorva, why do you think whistleblowers are reaching out to @user and not you and your colleagues?  http",2
1149,GO-VAXX Bus and pop-up clinics: Here's where to get your COVID-19 vaccine in Simcoe County  http  http,2
1150,"@user @user @user @user Really? So were they wrong when they said: ""COVID-19 vaccination has substantially altered the course of the pandemic, saving tens of millions of lives globally. However, inadequate access to vaccines in low-income countries has limited the impact in these settings"",",0
1151,We never had so many people dying of drowning before the COVID 19 vaccine. Makes you think...,2
1152,"No statistical difference in the incidence rate of both myocarditis (p =1) and pericarditis (p =0.17) was observed between the COVID-19 cohort and the control cohort, but this should have been on of the benefit of #vaccines.   #covid19  J. Clin. Med. 2022, 11(8), 2219  http",1
1153,Aaron Rodgers Wanted No Parts Of COVID-19 Vaccine Deaths Joke  http #hiphop #blackculture 👉🏾  http,0
1154,NHPC conducts special vaccination camp for Covid-19 booster dose and vaccine  http @user @user @user  @user @user @user @user @user @user @user @user @user @user,1
1155,@user If you didn’t test you would have no idea that you are spreading the virus.  The vaccine has turned you into the very thing you we’re scared about at the beginning of the pandemic. The vaccine has turned you into an asymptotic spreader of covid 19.  Typhoid Mary you have become,0
1156,"@user @user @user @user @user @user @user @user @user @user @user @user @user @user @user @user @user @user @user @user @user @user @user @user Oh look, you're pretending ivermectin works when it actually doesn't, as you pretend COVID-19 vaccines don't work when they actually do.  Seems you're just looking to help people die needlessly, unlike Fauci.   http   http  http",1
1157,I wonder if the lawsuits by staff will be coming and will the CEOS pay them.   Ontario hospitals plan to uphold COVID-19 vaccine policies amid 'crisis' staffing shortages  http via @user,0
1158,"Fact check: No, getting the COVID-19 vaccine doesn’t lower your immunity Source: CBS 17  http",0
1159,"@user @user @user China's vaccine is free, and China's treatment of COVID-19 is also free.",1
1160,"U.S. has the highest COVID-19 death rate per capita of all G7, and the highest Monkeypox case load. There is something wrong about our approach to Public Health. We have the tools, diagnostics, mRNA vaccine platforms and genomic surveillance networks.  http",0
1161,It's from the Covid-19 experimental vaccine.,2
1162,"@user  rules out: - immediate cost-of-living measures - immediate covid-19 or any public health measures - anything to support the majority of people in the UK - giving a flying fuck about anyone but himself  Come on #MSM, time for the clarion call  http",0
1163,BioNTech Sinks As Covid-19 Vaccine Sales And Profit Disappoint  http #digitalhealth #socialmedia #digitalmarketing #mhealth #industry40 #IoT #AI #healthtech  http,0
1164,@user That article is BS. The baby’s blood clots were not caused by the mother taking a vaccine. Stop spreading misinformation that could get people killed. COVID-19 can be deadly if you’re not vaccinated.   http,1
1165,"Breakthrough cases are when fully vaccinated people still test positive for COVID-19. This is normal, especially as variants circulate. Still, vaccines are extremely effective in preventing serious illness from the virus.   City health center vaccinations:  http  http",2
1166,Novavax COVID-19 Vaccine Primary Series in Adults Ages 18 Years and Older -  http #follow #viral #Health #HTiiips #tbt #motivation #inspiration #Direct From CDC #Video  http,1
1167,"UK Medicine Regulator Confirms COVID-19 Vaccines are at Least a Shocking 7,402% Deadlier than all other Vaccines Combined  http",0
1168,"@user CDC When people who are vaccinated get COVID-19 it is a breakthrough infection  People who get vaccine breakthrough infections can spread COVID-19 to other people. When a community reports more COVID-19 infections, that means more virus is circulating.  Vax'd are the spreaders.",2
1169,This week’s #vaxfactsfriday post is also about the #Omicron variant!  http,2
1170,@user @user “But there's no connection between these stories. A zoo official told USA TODAY the giraffes' deaths are unrelated to any COVID-19 vaccine – since the animals hadn't yet been vaccinated.” USA Today,0
1171,COVID-19 Vaccines | Why Are Pastors Pushing the mRNA-Modifying Nano-Technology COVID-19 Vaccines?  http,2
1172,Most Parents Say No to Covid-19 Vaccines for Toddlers  http Parents would be crazy to have their children vaccinated. CDC is not telling you the truth - research it - it is out there,0
1173,"Still silent on this? @user @user @user @user @user @user  UK Medicine Regulator confirms COVID-19 Vaccines are at least a shocking 7,402% deadlier than all other Vaccines combined  http",0
1174,"The new vaccine is called a ""bivalent vaccine"" that combines a component derived from a conventional strain and one of the Omicron strains, BA.1.",1
1175,Who's to say he's wrong  Didi Gregorius blames COVID-19 vaccine for career-worst season  Phillies’ Didi Gregorius blames COVID-19 vaccine for elbow issues  Phillies' Didi Gregorius links COVID vaccine side effect to down year,0
1176,Registered nurse Mary-Jane Stevens: COVID-19 vaccine was the biggest worldwide experiment and there is no data to support it. All the health worker were guinea pigs and they were forced to get injection.,0
1177,@user @user @user @user @user @user @user @user @user @user @user @user @user @user They aren’t graphs they are vertical bar charts with a trend line connecting the mid points of the bars.  Vaccine rollout began in Germany on 26 December 2020.  If the Covid vaccines are effective then why hasn’t Germany eradicated Covid-19?  http,1
1178,It’s National Immunization Month! Check out the amazing work the #PRCnetwork is doing to increase COVID-19 vaccine confidence in their communities:  http  http,2
1179,"Former White House COVID response coordinator Dr. Deborah Birx said she ""knew"" that COVID-19 'vaccines' ""were not going to protect against infection""  http",0
1180,Sperm not affected nine months after COVID-19 mRNA vaccination  http #Coronavirus #Disease #COVID #Sperm #Fertility #Vaccine #COVID #Testis @user  http,2
1181,"c sp sit li quy dnh phong chng #Covid19 v lo ngi bnh [  http ] a phuong co t l tiem vaccine COVID-19 mui nhc li thp nhom t 12 dn 17 tui.Chu thich nh Mt dim xet nghim COVID-19 ti Frankfurt, c.nh tu liu  http",2
1182,⬇️⬇️⬇️Listen to this!!⬇️⬇️⬇️   #vaccine #myocarditis #Covid_19,2
1183,#ICYMI - COVID-19 booster campaign with reformulated vaccine to launch in September – Read more via @user :  http,1
1184,@user @user,1
1185,9-Year-Old Dies Two Weeks After Taking COVID-19 Vaccine: VAERS Just one death is too much.  http,2
1186,Health Care Workers Who Sued Over COVID-19 Vaccine Mandate Win $10 Million Settlement   http  http,1
1187,"In the latest episode of our podcast series, “Race and Regulation,” Olatunde Johnson @user examines disparities in COVID-19 vaccine access, drawing lessons not only for the next public health emergency, but for addressing social inequities generally.  http  http",2
1188,@user WHAT'S OWED!  Newsweek  Reparations $151M for Ea. African American Experts Say Money Alone Isn't Enough! It must also address Systemic Change!  1.Decendants of Slaves  2.Conflict of Interest in Police Shootings-Criminal Cases  3.COVID-19 Vaccine Genocide    http  http,1
1189,"@user Reuters Fact Check  @user · 3 août False claims that COVID-19 vaccine producers skipped animal trials due to the animals dying have resurfaced online. Pfizer-BioNTech, Moderna and Johnson &amp; Johnson conducted these trials and had no significant safety",0
1190, http #BadDecisions did they Atlantic basically just say that the covid-19 vaccine is not 100% effective at fighting back covid from evolving faster then we can create these therapeutics because I think they did,0
1191,"""The European Medicines Agency on Thursday warned of severe allergic reactions as a potential rare side effect of Novavax’s coronavirus vaccine.""  'EMA adds allergic reaction warning to Novavax’s COVID-19 vaccine'   http",0
1192,"Чи потрібно брати з собою свідоцтво про вакцинацію проти COVID-19, виїжджаючи з України для перебування у іншій країні, навіть якщо термін дії сертифіката закінчився? | COVID-19 Info Vaccines  http",1
1193,"In the latest episode of our podcast series, “Race and Regulation,” Olatunde Johnson @user discusses how the COVID-19 vaccine rollout exacerbated racial health disparities—and what lessons regulators can learn for promoting greater social equity.  http  http",2
1194,FDA Approval of COVID-19 Vaccines for Infants and Young Children Is ‘Egregious’  http,2
1195,.@DrElisaChoi says “COVID-19 vaccines are death prevention tools” @user @user,2
1196,@user ‘Learn how health officials consider COVID-19 vaccines safe for most people’   What a fact check guys!!!! This post is very misleading towards the virus,1
1197,Real-World Bombshell: Professor in Scotland Declares Excess Deaths in Scotland Linked to COVID-19 Vaccines  http,0
1198,"India’s Cumulative COVID-19 Vaccination Coverage exceeds 205.59 Cr  🌀Over 3.93 Cr 1st dose vaccines administered for age group 12-14 years  🌀India's Active caseload currently stands at 1,35,364  Details:  http   #LargestVaccineDrive  http",1
1199,European Medicines Agency recommends Novavax add warning to their COVID-19 vaccine  http,1
