,text,labels
539,Real-World Bombshell: Professor in Scotland Declares Excess Deaths in Scotland Linked to COVID-19 Vaccines  http,0
540,"A complete #twitterexposed lie. No vaccine, ever, has had 'no safety concerns,' according to actual fact-checkers.  ""All #COVID-19 vaccines were tested on animals and there were no safety concerns, medical experts say.""",0
541,Illinois hospital system to pay $10.3 million in settlement with workers over COVID-19 vaccine mandate  http,1
542,"About a month and a half after Covid-19 vaccines became available to kids under 5 in Washington state, just under 9 percent have had their first shot. That’s significantly lower than all other age groups.  http",1
543,@user @user @user those were precautionary measures because these peoples jobs are indispensable and so they must be kept healthy. But this from the CDC:  •COVID-19 vaccines are available for everyone ages 6 months and older at no cost. •Vaccines were paid for with taxpayer dollars...,1
544,"@user @user Personnellement je sais que beaucoup de Médecins (voire plus !) ne sont pas vaccinés en prétendant l'être, pour ne pas perdre leur Job. Ce qui ne les empêchent  pas de vacciner leur clientèle.Ce sont de sacrés faux-cul.Les ARS savent. ""Covid-19 ou l'Honneur perdu de la Médecine""",1
545,Army Officer Designated a Threat After Refusing to Get a COVID-19 Vaccine RIDICULOUS AS BIDEN HIMSELF HAS SHOWN FULLY VACCINATED STILL GETTING INFECTED   http,0
546,Recent Decision: Universities Can Enforce COVID-19 'Vaccine' Mandates Even if Local Public Health Authorities Don't Ask Them To  http,2
547,"Literally what umbrella corp would say before a zombie outbreak   “All COVID-19 vaccines were tested on animals and there were no safety concerns, medical experts say”   http",2
548,Bharat Biotech expects regulator’s nod for intranasal COVID-19 vaccine this month  http,1
549,The Senate is now voting on .@tedcruz amendment to send the bill to the Homeland Security Committee to remove the requirement DC students receive #Covid_19 vaccine. The vote was DENIED!  He's just throwing random amendments.,0
550,"New COVID-19 vaccine boosters, targeting new Omicron strains of the virus, are expected to roll out across the U.S. in September.  http",2
551,"(...) I'm just sourcing. What I didn't say my censoriphic people.  ""Subacute thyroiditis after the third dose of the COVID-19 mRNA vaccine. Case report.""  http",0
552,"@user @user @user @user @user I’m not trying to be ugly, but before Covid 19, did you believe that “vaccines” prevented infection? That was the common understanding. Can we not agree that the Covid 19 “vaccine” is actually a prophylactic, rather than something that prevents infection?",2
553,"@user @user It's good to expect your govt to do better, but hailing an autocratic govt for its irrational covid-19 policy is not right when we don't even know how many of it's citizens succumbed to Covid-19. It will serve China better if it gives good vaccines to its citizens.",0
554,@user @user Masks give the first level of protection. Vaccines are not a cure for covid-19. it is like a condom and STD why learned people are behaving like IDIOTS wrt to covid-19,0
555,"South Africa’s health products regulator reports the first death that has been tied to the taking of a Covid-19 vaccine, saying that the patient had been given a Johnson &amp; Johnson shot  http via @user @user",1
556,"I recently read that a century ago, Greece had avoided the Spanish Flu by avoiding the vaccines. If true, that could be a useful key to fighting Covid-19.",1
557,"Looking back, I realise that I &amp; many people I know, got so many things wrong about #Covid_19 virus, vaccine &amp; the pandemic response by the scientists, doctors, society &amp; Govt So many dots we couldn’t connect. A scientific &amp; societal audit could help us be more sensible next time",1
558,🇺🇸Military Faces National Guard Refusals and Legal Blockade over Disobeying COVID-19 Vaccine Order  http,0
559,"Keihard bewijs dat hoe meer injecties, hoe groter de kans  op herinfectie en ernstige complicaties  COVID-19 Vaccines Hinder the Immune System, Lead to More Severe Illness: Dr. Robert Malone  http via @user  http",2
560,FDA advisers vote in favor of authorizing Covid-19 vaccines for children as young as 6 months  http,2
561,"Most Parents are Saying No to Covid-19 Vaccines for Toddlers  “More than a month after the COVID-19 shots became available, roughly 4% to 5% of children under 5 years have received them.”  http",0
562,"Moderna CEO Stéphane Bancel says the company is looking into working on a monkeypox vaccine, but with less urgency than they did with COVID-19 because there's already a vaccine on the market and it's not an airborne virus.  http",1
563,"Tuesday, Aug. 9 from 10 to 11:30 a.m. and 1 to 3:40 p.m. the Kids Mobile Medical Clinic bus will be located at Latin PCS to provide FREE back-to-school vaccines, including the COVID-19 vaccinations, to all D.C. children ages 6 months and up and their families.  http",1
564,Twitter Threatened With Class-Action Lawsuit for Banning Doctor Over COVID-19 Vaccine Post  http   http,2
565,@user @user @user Sigh... 🤦‍♀️🤦🤦‍♂️ #OANN #OnlyAbsurdNonsensicalNews Widespread claims that 108 FIFA soccer players have died in a six-month period in 2021 are not based in fact – nor are suggestions that the alleged deaths are linked to COVID-19 vaccines. @user  Fact Check  http,0
566,"Si vous obtenez un résultat positif au test de dépistage de la COVID-19 ou si vous avez des symptômes et que vous ne pouvez pas obtenir de test, ET que vous n’êtes pas entièrement vacciné ou que vous êtes immunodéprimé, l’auto-isolement est de 10 jours.  http",1
567,@user @user @user It seems Whit's only reason to get the vaccine was so he could play for a contending team. When this guy should of set a good example and gotten the vaccine when he 1st could. Tired of these athletes and the games they play with the Covid-19 vaccine.,1
568,"Live! S.C.A.L.E.S 3.0. STRATEGY LAUNCH Boss Mustapha, Sec. to the Federal Government the Federation - ""I urge leaders to mobilize all eligible subjects to take the covid-19 vaccine. It is a fact that we are not out of covid-19 yet. Data shows  an increase in cases globally""  http",0
569,"@user @user I was never told or even heard of the vaccine stopping you catching or spreading Covid-19, just decreases the severity. I hear this loads from the anti vax movement and don’t get it 🤷‍♂️",0
570,One death confirmed directly related to Covid-19 vaccine  http,1
571,"Nothing Short of Horrific Experiment; Marine Punished For Refusing Vaccine Mandate; COVID-19 Vaccines Hinder the Immune System, Lead to More Severe Illness  http",2
572,"the characteristics of the immune response   to an infection with SARS-CoV-2 as compared with (natural-my words inserted)  the immune response to an mRNA vaccine against COVID-19 (Ivanova et al., 2021).” (vaccine induced-my words inserted)",1
573,"Une étude de l'école de médecine de Harvard intitulée ""Electronic Support for Public Health-Vaccine Adverse Event Reporting System"" indique que  Le système VAERS n'enregistre que ""moins de 1 %"" des effets secondaires et des décès liés aux vaccins Covid-19",1
574,FDA and CDC recommend Novavax COVID-19 vaccine: What to know   http,2
575,Already got my covid-19 vaccine booster but here I am still looking for my daily booster 🤡,2
576,"“Jones is not .. 1st person to grift off conspiracy theories, but Infowars harnessed the power of the internet to do so on a massive scale — a model .. been imitated by anti-vaccine advocates, COVID-19 deniers &amp; champions of baseless claims that former ..”  http",1
577,"A lack of testing data and medical guidance led many to avoid the COVID-19 vaccine during pregnancy, unwittingly increasing their chances of a stillbirth.  http",2
578,"@user @user @user I was gobsmacked at the beginning of the covid-19 pandemic, when I found out Australia does not make any vaccines. It is yet another of many ways Australia is a backwards country. #auspol",0
579,"There is a minimum time that you should wait after a positive test or your first COVID-19 symptoms, or since your last dose of the vaccine, before coming forward.   Find out more at  http ◀️  #NHSGGC  http",1
580,"@user @user @user @user @user Know why vaccines even exist? Because they ended smallpox.  Know what will never happen with the current covid 19 vaccine? Ending covid19. Even with 100% ""vaccination"" of the entire population.",1
581,Possible Link Between COVID-19 Vaccination and #Autoimmune Disorders: Investigation by NCKU Researchers. These findings point to a possible association between SARS-CoV-2 mRNA vaccines and autoimmune diseases like AHA.  http  http,2
582,"Community gymnasiums, basketball courts, tennis courts and ice pads are still occupied by COVID-19 Vaccine injection set-ups, almost 3 years  Healthy lifestyle has been replaced for failed, hazardous vaccines   Leave injections to doctors   @user @user",2
583,There’s been a lot of controversy regarding Covid-19 vaccines globally and South Africa reporting its first death linked to one of the vaccines does not help at all. What do people really need to know about the virus and it’s vaccines? I wish there was more awareness about this,0
584,@user @user,1
585,"Starting today, the Pandemic Operations Center is offering the Novavax COVID-19 vaccine.  Novavax is approved as an initial vaccine series and boosters are not approved at this time.  No appointment is necessary but can be made at  http #Novavax #COVID19  http",2
586,"Biden tests positive for COVID-19 again, will continue White House isolation   http    Doubt highly that he ever received the lame vaccine ‼️‼️‼️",0
587,@user @user That’s the nature of Covid-19 &amp; the immune system’s ability to stave it off. Not the delivery mechanism (mRNA). Vaccines based on other delivery tech have same result.  There aren’t any other vaccines per se using mRNA yet.  Just some experimental cancer treatments,0
588,"@user @user @user The Covid vaccine in NOT a vaccine? I’m confused. How’s that work? It literally preps the immune system to combat the Covid-19 virus, just like a vaccine should. 🤷🏽‍♂️",0
589,"@user @user @user @user @user COVID-19 vaccines have saved millions of lives, which you'd know if you did more than 2 minutes of research.",2
590,@user Example of dis/misinformation: “Covid-19 vaccines are safe &amp; effective”. An accurate statement: “the vaccines are relatively safe in the short term &amp; moderately effective at preventing serious illness among at-risk individuals”. I’ve completed your 1st assignment for you.,1
591,Health Canada says “The safety and efficacy of Pfizer BioNTech COVID-19 vaccine in pregnant women has not yet been established in the clinical trials”After telling pregnant women it was tested and was “safe and effective”.  … http  http,0
592,"They rather let you die, than hire someone who follows true science.  This is horrific. Plan to die if you need help. Say goodbye  #death #health  Ontario hospitals plan to uphold COVID-19 vaccine policies amid 'crisis' staffing shortages  http via @user",2
593,@user @user « Parfaitement sûr » 🧐 Bonne écoute ☺️ Bonne lecture 🤓  Site de vigilance pharmaceutique de l’OMS  http (faire rechercher avec les termes COVID-19 vaccine),1
594,Register for the August 18th Digital Dialogue: Engaging Parents Around Newly Approved Pediatric COVID-19 Vaccines and Building Vaccine Confidence.  http  http,1
595,Netiporn has one standing detention order on charges relating to a protest at the Ministry of Public Health on 13 July 2021 to call attention to the uneven distribution of Covid-19 vaccines. Lawyers are currently seeking bail for her.  (Photo by Ginger Cat)  http,1
596,@user @user @user @user @user There is literally no way you could actually believe a vaccine for Covid-19 would cause someone to cause a crash like this. If that’s the case I would suggest seeking mental help.,0
597,@user @user The Indians probably removed all the Dangerous stuff from covid-19 Vaccines,2
598,Audio of a RI Cardiologist confirming a Brown U Student Covid-19 Vax-Related Myopericarditis Case #vaccines #Myopericarditis #BrownUniv  http,1
599,@user @user Pay Attention: They are talking about COVID-19 vaccine 🙄🙄🙄 AND YES IT'S WRONG!!  OUR BODY OUR CHOICE!,0
600,Who Gave Approval for Third Dose of COVID-19 Vaccines in India? Centre Refuses to Answer.  👇   http,0
601,Birx Says COVID-19 Vaccines Were Never ‘Going to Protect Against Infection’  http,0
602,Adolescent COVID-19 vaccine study ‘very encouraging’ for hesitant parents  http,1
603,"@user @user @user @user ""Dr. Lourenco acknowledged that the current efficacy of the Covid-19 vaccine would not have passed the regulatory threshold ( 50%) that was required in order to initially approve the vaccine for use in Canada.""",1
604,"@user DeSantis appointed Joseph Ladapo, a vocal supporter of his COVID-19 policies, as Florida's surgeon general. Ladapo has a history of promoting unproven treatments against COVID-19, opposes COVID-19 vaccine requirements, and has questioned the safety of COVID-19 vaccines.",2
605,Twitter Threatened With Class-Action Lawsuit for Banning Doctor Over COVID-19 Vaccine Post  http via @user   Is Elon Musk aware of this?,2
606,Alberta Health Services has dropped its COVID-19 vaccine mandate as a condition for employment. An incentive for the unvaccinated or those who don't more boosters. Ontario should do the same. Repeal Bill 124.,2
607,"@user @user ""Jewish"" shills discussing how to force mandatory  Covid-19 vaccines for minors?",0
608,Vaccines for Covid-19 aren’t required in schools this fall  http,2
609,@user Protected from what? Tragic the data doesn't indicate that children are affected by Covid-19 but there is alarming evidence of serious side effects from the experimental drugs/so called vaccines!,0
610,"Today (6 August) Allcures Pharmacy in Grays is hosting a NHS pop-up clinic for the COVID-19 vaccine until 3pm.   Just turn up to this walk-in clinic for your 1st, 2nd or booster COVID-19 vaccine. This clinic is available every Saturday in August.   http  http",2
611,.@CedarsSinai imagine a hospital that prides itself on “ science” mandating all visitors to have proof of a Covid 19 plus booster vaccination to visit loved ones. All the while knowing the vaccine does not stop transmission. #science #CDC #BadDecisions,2
612,"#Bloomfield #jobs #hiring #opportunity @ CVS (Bloomfield, NJ) - COVID 19 Vaccine Support Pharmacist  http",1
613,"Si resides en JALPATAGUA y deseas vacunar a tus hijos, ya puedes acercarte a tu centro de salud más cercano. #COVID19 #vaccine #PREVENCIÓN  http",2
614,"“Pharmaceutical companies and government officials failed to ensure that pregnant people were included in the early development of the COVID-19 vaccine, a calamitous decision made amid the urgency of a rapidly spreading pandemic.”",0
615,"@user Dillon Quirke had heart problems for years, before the COVID-19 vaccines were invented. In 2018, Quirke took a break from hurling after he contracted viral myocarditis",0
616,"@user @user Think of what could have been done if the gullible hadn’t voted the clown in. We would have still had the growth and sustained it during the pandemic, because we would have put people over profits and prioritized the vaccine. And over a 1M people wouldn’t have died of Covid-19",1
617,"India registers 20,551 new COVID-19 cases, active cases decline to 1,35,364  #india #covid #omicronvariant #vaccination #vaccines #healthnews #healthcare  Read more at:  http",1
618,"Its 2022! There should be ZERO testing on animals!!! @user @user @user DO F’ING BETTER!!! #NoAnimalTesting   “All COVID-19 vaccines were tested on animals and there were no safety concerns, medical experts say”   http",0
619,"With the right information at their fingertips, healthcare workers can better plan their COVID-19 vaccine rollout. Find out how Microsoft teamed up with UNICEF to better manage the process:   http  http",2
620,Then how did I know about it?  Liars.   EXCLUSIVE: CDC Claims Link Between Heart Inflammation and COVID-19 Vaccines Wasn’t Known for Most of 2021  http via @user,0
621,"Australia does NOT recommend Covid shot for healthy children 0-5 ! But Canada does!?!? Since the government lied about reasons for Covid policy, show us the study!  ATAGI recommendations on COVID-19 vaccine use in children aged 6 months to  http",0
622,SAHPRA confirms one death from Johnson &amp; Johnson COVID-19 vaccine  http,1
623,"TUCKER: COVID-19 Vaccines May 'Suppress' Immune System, Studies Show  http #Truththat",2
624,"Covid-19 : Seuls 11,46 % des Sénégalais ciblés vaccinés  http",2
625,"@user Hello Dr Doom, I just received an email about NOVAVAX COVID-19 VACCINE NOW AVAILABLE.  If you're vaxxed and double boosted, I'm high risk, should I get this? @user",0
626,"@user @user @user @user Read the article I shared. .„he waited until May 2021 to get his first COVID-19 vaccine, to align with and wait for the vaccination campaigns in Africa and other low-income countries.“",1
627,Harris County Public Health now administering COVID-19 Novavax vaccine  http,2
628,"Le ministre de la Santé François Braun a fait savoir ce 22 juillet que le gouvernement avait décidé de dire non à toute réintégration de soignants non vaccinés contre le Covid-19, expliquant se ranger derrière «l'avis des scientifiques».   http",0
629,"@user Liar. “According to the Council of the District of Columbia website, ""No student shall be admitted by a school unless the school has certification of Covid-19 immunization for that student or the student is exempted."" They can get an exemption. Like any other vaccine.",0
630,DC Schools Will Expel Students Who Choose Not to Get the COVID-19 Vaccine  http This seems suable to me.,1
631,Covid-19 vaccine: Japan approves Covaxin booster dose for travellers  http,2
632,"@user @user Most vaccines are proven to do something before they are mandated. Covid vaccines haven't really proven on any metric that they positively affect kids resistances to covid-19. In fact, if they work like others, then they actually weaken the kids immune systems for the first week.",0
633,■  http How to use it:  ▲ Select  ● COVID-19 MRNA VACCINE MODERNA (CX-024414) or ● COVID-19 MRNA VACCINE PFIZER-BIONTECH (TOZINAMERAN) or  ● COVID-19 VACCINE ASTRAZENECA (CHADOX1 NCOV-19) or  ● COVID-19 VACCINE JANSSEN (AD26.COV2.S)or,2
634,Vitamin D: Nature’s Natural Covid-19 “Vaccine” | Nature's Real Health  http,2
635,Covid-19: Conditional approval for Spikevax vaccine for aged 12 and above  http  http,2
636,No comment. Just read  and think. ATAGI recommendations on COVID-19 vaccine use in children aged 6 months to  http,1
637,Vanderbilt researchers take leadership role in COVID-19 vaccine development | Vanderbilt University  http,2
638,"Today, York Region is reporting 62 COVID-19 hospitalizations with 4 new admissions and 1 fatality.   89.2% of residents age 5+ have received at least one vaccine dose; 86.4% have been vaccinated with two doses.   Learn more at  http  http",1
639,"@user @user @user Did u actually read the article? ""A COVID-19 vaccine can prevent your child from getting COVID-19 and spreading it at home and in school.  If your child gets COVID-19, a COVID-19 vaccine could prevent severe illness.""",1
640,(2/2) .. antibody levels against SARs-CoV-2 following COVID-19 vaccine boosters in adults in the United States during the omicron wave. Moderna-only primary/booster vaccine substantially boosts and maintains high antibody titers over time.,2
641,Live in Jersey like me? The first day of school is right around the corner!  Now is the time to vaccinate your little ones against #COVID-19 to ensure they'll be ready. The @user recommends COVID-19 vaccines for every child 6 months and older.,1
642,Happy to share our recently published paper describing some interesting findings for the design of  more effective vesicular stomatitis virus (VSV)-based COVID-19 vaccine candidates.  http,1
643,@user The updated analysis from your most recent study with BioNTech only shows that your COVID-19 vaccine is 100% effective in making billions in profits,2
644,BREAKING: More than 130 U.S. Coast Guard members filed a class action lawsuit against the Biden administration’s COVID-19 vaccine mandate.  The Coast Guard members had valid religious exemptions which were unlawful denied.  We have to keep fighting.,0
645,Misrepresentation of Germanys Data on Unverified COVID-19 Vaccine Side Effects  http,0
646,"I sincerely hope I'm wrong about this, the same as I hoped I would be wrong about the vaccines. We need to #Fightback against the #WEF and the destruction of our #freedom #WEFcrimesAgainstHumanity #TheGreatResist  #WW3 #Chinese #WorldWar3 #Covid_19 #KlausSchwab #FreeSpeech  http",0
647,"1) COVID-19 Vaccine Adverse Events in Ontario (July 17 to August 1)  There were 115 new reports during this period, with 1 more individuals either dying or requiring hospitalization.  Source:  http  http",1
648,"Novavax COVID-19 Vaccine Can Cause Heart Inflammation: European Regulator: The COVID-19 vaccine made by U.S.-based Novavax can lead to the same types of heart inflammation that have occurred after vaccination with the Pfizer and Moderna shots, Europe’s…  http  http",2
649,"COVID-19 Jabs Killing One in Every 800 Over-60s, Says Top Vaccine Scientist  http #corruption #covid #Vaccine",2
650,"Discrimination is contempt of Supreme Court - Covid-19 vaccines are exptl, phase-3 trials are ongoing - Coercing a medical experiment on a fellow human is deeply wrong Evidence-based decisions are a must #arrest_SunilChavan  #EndTheMandates",0
651,"Andy Vermaut shares:Canada: COVID-19 Vaccination Rates Lower for Indigenous People in Urban Areas: Ontario government made getting the COVID-19 vaccine to indigenous people a priority, but uptake remained lower than in the general population,…  http Thank you.  http",2
652,"COVID-19 vaccine mandate for Canadian military will be ‘tweaked,’ says defence chief #123INFO  http",1
653,"In this 17 minutes audio recordning, NEJM editors discuss on 03/08/22 soon-to-be-released Covid-19 vaccines against BA.4/BA.5 strains.           Link:  http",0
654,"No single magic bullet against this virus?! Lol.  Yet he had the Dan Andrews government conveniently believing that vaccines were the magic bullet.  Ventilation .. airflow .. yes yes, Korea published 'Flattening the curve on Covid-19' more than 2 years ago  http",0
655,Shhhh.....nothing to see here 9-Year-Old Dies Two Weeks After Taking COVID-19 Vaccine: VAERS  http via @user,0
656,Covid-19 vaccine efficacy further challenged by emergence of ‘buried’ vaccine hospitalisation statistics  http via @user,0
657,“I had to swallow my rage similarly with COVID-19 seeing relatives pass away in India w/out vaccines or antivirals or basic life support while the US was throwing away doses as some ppl refused to take it.” /3  http,1
658,"@user But most importantly you MUST INFORM parents that the Covid-19 vaccines can cause Myocarditis and Pericarditis in children, so parents can make an informed decision.  INFORMED CONSENT IS A MUST !!",1
659,@user Agents drew blood from Trump searching for the microchip that was introduced into his bloodstream along with the COVID-19 vaccine.,2
660,"Hope people now will see reason  not to take inadequately tested new treatments 😔 COVID-19 Vaccines Hinder the Immune System, Lead to More Severe Illness: Dr. Robert Malone  http",0
661,Exciting news from the #NeoVac team – our new generation mRNA-LNPs are proven to be stable for at least 1 year at 4°C. More thermostable lipid nanoparticles mean broader access to #COVID-19 and other #mRNA vaccines worldwide.  @user  http,1
662,What should be done with Canada’s expiring COVID-19 vaccine doses?  http,2
663,@user What religion specifically specify not to take the covid-19 vaccine.,1
664,@user @user How do you know that there are no deaths that resulted from the Covid-19 vaccines?,1
665,BREAKING: More than 130 U.S. Coast Guard members filed a class action lawsuit against the Biden administration’s COVID-19 vaccine mandate.  The Coast Guard members had valid religious exemptions which were unlawful denied.  We have to keep fighting.,0
666,"@user Follow the current science, follow the data and research around why one should or should not get a COVID-19 vaccine. Same for masks. It's very nuanced.",1
667,"""They report that this study found higher COVID-19 mRNA vaccine use in particular municipalities in the Netherlands, “correlates with a notable increase in deaths from all causes.”   Netherlands Study: mRNA Vaccines Correlated with Excess Deaths  http",2
668,@user @user Present this info to those forcing jabs on students! 1000 Peer Reviewed Studies Questioning Covid-19 Vaccine Safety   http,1
669,@user @user LewisE eYeS to vaccine daasc XZzzzzzz  http,2
670,NYers ages 6-months &amp; older can now get the COVID-19 vaccine. Visit  http for more information.,1
671,Everyone age 6 months+ is eligible to receive the free COVID-19 vaccine. Protect your child by getting them vaccinated as soon as possible. Visit  http now to schedule a vaccination appointment or find a local walk-in vaccination site.  http,1
672,KFF COVID-19 Vaccine Monitor: Issues And Precautions Amongst Adults Who Report A Weakened Or Compromised Immune System  http,1
673,@user Why do you choose to take your own life by getting the deadly jab   Get your covid-19 Digital QR certificate or PAPER CARD without taking the vaccine. Send a dm to get your QR Scan Covid-19 Passports without taking the vaccine.  Click on the link below   http,1
