,text,labels
1596,"COVIDIOTS Covid-19 is on the rise again in the UK. After multiple lockdowns and more than 197,000 deaths, experts are warning we’re now entering a fifth wave of the pandemic. So why are around 4 million adults in the UK refusing the vaccine?  http #Covid #CV19",2
1597,Dr. Oh explains why long-term side effects from the COVID-19 vaccine are unlikely. Learn more at  http  http,1
1598,Pfizer and BioNTech will begin trials of their updated mRNA Covid-19 vaccine designed to protect against the newer BA.4 and BA.5 sub-variants of the coronavirus later this month.  http,0
1599,"Since the #Covid_19 #vaccine does not prevent the spread, requiring people to have the vaccine to travel is pointless. Some individuals immune systems handle the #virus just fine. Why should they be required to get the vaccine? So many inconsistencies and irrelevant measures.",2
1600,"It’s safe, effective, and the best news yet for all who have been parenting through this pandemic. The COVID-19 vaccine is here for everyone 6 months and older. Learn more to help protect your kids:  http  http",1
1601,"Une étude de l'école de médecine de Harvard intitulée ""Electronic Support for Public Health-Vaccine Adverse Event Reporting System"" indique que Le système VAERS n'enregistre que ""moins de 1 %"" des effets secondaires et des décès liés aux vaccins Covid-19.  http",1
1602,Make sure kids are up-to-date on their COVID-19 vaccines before the start of school! Children 5 and older are eligible for vaccine boosters. Learn more about vaccine boosters by visiting:  http  http,1
1603,"@user Why do people bring up polio when they are trying to get people vaccinated against Covid 19 this vaccine isn't a vaccine, it is merely a treatment.  A vaccine prevents spread and sickness. Joe Biden got sick twice after god only knows how many shots...",0
1604,L’Australie vaccine les enfants de moins de 5 ans contre le COVID-19 – sans aucune évaluation sérieuse des risques  http via @user,2
1605,"Sigh…this isn’t even a conversation. Why?! Vaccines save lives. Children may not die, but they infect others, who have and will die. School vaccine mandates for Covid-19 are not happening - Vox  http",2
1606,AGRÉABLE FIN DE SOIRÉE LES AMI(E)S. PLEASANT EVENING MY FRIENDS  ET POUR CONCLURE CETTE JOURNÉE TORIDE  BIDEN 4 FOIS VACCINÉS POURTANT SEUL À L’ISOLEMENT CAR  POSITIF À LA COVID-19 À 2 REPRISES EN L’ESPACE DE 15 JOURS QUI PORTE UN MASQUE FFP2 AU TÉLÉPHONE  AMUSANT N’EST-CE PAS ?,2
1607,"🙌Covid Vaccine Lawsuits Begin  NorthShore University HealthSystem in Chicago sued by Liberty Counsel: violation of workers by dismissing religious exemptions and forcing workers to receive the COVID-19 vaccine.  Settlement: $10,337,500.  http",0
1608,"As of 4pm today, Cambridge is reporting: 28 newly reported COVID-19 cases. 0 newly reported COVID-19 deaths. 20.3 cases per 100,000 residents, 7-day moving average. 90% of residents with at least one vaccine dose and 73% fully vaccinated. More at  http #CambMA  http",0
1609,"The European Medicines Agency (EMA) is recommending Novavax's #COVID-19 #vaccine carry a warning. If you have experienced injury or loss due to an adverse reaction to a COVID-19 vaccination, contact us on 1800 874 949 to find out how we can help.  http",1
1610,"There will also be a COVID-19 vaccination clinic at Cascades Library in Loudoun today, August 8 from 2:30pm-4:30pm for children who are 5 years and older. [Image:  COVID-19 Vaccine Loudoun Flyer].  http",2
1611,"REMINDER: COVID-19 Vaccine Pop-Up Clinic TODAY at CMHA  📅 Tuesday, August 9, 2022 🕑 1 pm - 4 pm 📍 1400 Windsor Ave., Windsor  No appointment needed. @user  http",1
1612,P.S. THERE IS AND NEVER HAS BEEN A VACCINE FOR COVID 19. STOP SAYING YOUR VAXXED . THERE ISN'T A VACCINE TOO DATE AVAILABLE. IT'S BIGGEST MEDICAL CON IN HISTORY.,0
1613,"🔥✍️😘#TheLORDReigneth⚡🕊️🔥🔥🔥🔥🔥💯⚖️❤️🔥🔥🔥🔥🙌   COVID who? COVID is Dead and I KILLED it. I don't live in those fears. I Fear the LORD, a Pure Christian. #ReMinder Pfizer takes no liability of the COVID-19 Vaccines if you are harmed or die from it!  (#John 1:1)😘#Jesus❤️🙌",1
1614,No. The article is only showing a very rear outcome from the Johnson and Johnson Covid-19 vaccine is extremely rare!! People should continue to get their covid-19 shot(s)!! It is no different then getting any kind of shot like school vaccinations as some in rear cases may have,0
1615,Real-World Bombshell: Professor in Scotland Declares Excess Deaths in Scotland Linked to COVID-19 Vaccines  http,0
1616,Novavax has slashed its revenue guidance by about half in the face of a lack of demand for its Covid-19 vaccine and an oversupply in the market — news that sent the company’s share price into a nosedive during after-hours trading.   http,1
1617,coronavirus and monkeypox been around since the 90s however Covid-19 was man-made in China. Our government used the outbreak to see how we as a country would react to lockdowns and mandatory rules like masks and vaccines,0
1618,Canadians &amp; the Global Community must maintain proven effective defence against the most dangerous killer. It has been proven that vaccines alone are not sufficient weapon to win the fight against Covid-19. Government of Canada collects a lot of tax money to protect Canadians.  http,1
1619,First settlement reached for health-care workers in lawsuit filed over COVID-19 vaccine mandate  http via @user,1
1620,Misrepresentation of Germany’s Data on Unverified COVID-19 Vaccine Side Effects  http,0
1621,"for people who are against taking the covid 19 vaccine, what describes you better?",2
1622,"West Paris COVID-19 Vaccine Clinic August 15, 3:00 - 5:30 PM No appointment needed Ages 18+  http",1
1623,"It’s estimated that COVID-19 vaccines have saved millions of lives, but false claims continue to cast doubt on their safety and efficacy. One such claim that has spread around the world falsely suggests that three Canadian doctors died from the shots.  http",2
1624,No. The COVID-19 vaccine isn’t responsible for the spread of Moneypox (not even sure how that would work)  But a world population with a weaken/damage immune systems because of the COVID-19 pandemic is likely a factor in it.,2
1625,Almost 93% in Costa Rica have the first dose of the covid-19 vaccine  http,2
1626,"This schedule does not include clinical details necessary for administering COVID-19 vaccines. For clinical details, see the resources at the end of the document.  Please see the document above for further details.",0
1627,"Study in @user finds COVID-19 vaccination was estimated to prevent:   ✅27M infections ✅1.6M hospitalizations ✅235K deaths   ...in the US from Dec 1, 2020 - Sept 30, 2021.   In short, vaccines ROCK!   http",1
1628,"1st dose: [████████▋　　　]　72.63%  2nd dose: [███████▉　　　　]　66.46%  Vaccines: Corbevax, Covaxin, Novavax, Oxford/AstraZeneca, Sputnik V Total 1st dose: 1022282731 (+148562) Total 2nd dose: 935516836 (+458989)",2
1629,@user @user @user @user @user @user @user Covid 19 is worldwide pandemic. Vaccine and mask mandate should be enforced. Is women abortion a worldwide pandemic?  The answer is no.,0
1630,Families fighting for a bespoke UK compensation scheme for Covid-19 vaccine Injured. @user  http,1
1631,"Some Alberta parents are hesitant to give the COVID-19 vaccine to their young kids, and uptake has been slower than expected.  “I am really afraid for my daughter.""  http",1
1632,"Lancet: Vaccine effectiveness against COVID-19 beyond 6 months remains incompletely understood. Hm, podejrzewam, że rozumieją ale ""niedobra o tym mówić...""  http",0
1633,MODERNA TO APPLY FOR JAPAN APPROVAL OF NEW COVID-19 VACCINE TARGETTING OMICRON VARIANT ON WEDNESDAY -KYODO,2
1634,"Do you need your first, second, or booster COVID-19 vaccine, or even your second booster? Then attend the GO-VAXX bus COVID-19 clinics for doses available for eligible individuals age 5 &amp; over.   #IndusHelps #Vaccines  http",2
1635,@user @user Except the FDA did approve of Moderna and Pfizer Covid-19 vaccines.,2
1636,"@user I really do wonder how Wolf spiralled down into this nonsense. She also recently wrote a screed about abortion that's eye-popping for a supposed feminist. Also harassing a restaurant in Salem, Oregon for their Covid_19 vaccine indoor seating policy. Just what happened to her?",2
1637,"Now the very same people who were encouraging people to vaccinate they must also come forward and answer, the first one is Cyril many people died because of the so called covid 19 vaccines. Where are they even radio 📻 stations ? My mum experienced heart attack coz of it",1
1638,@user Fact...  67% of the world population has received at least one dose of a COVID-19 vaccine. 12.36 billion doses. Research done...,1
1639,Obstet Gynecol   .  Safety of Booster Doses of Coronavirus Disease 2019 (COVID-19) Vaccine in Pregnancy in the Vaccine Adverse Event Reporting System  http,2
1640,"South Africa's health regulator reported a causal link between the death of an individual and Johnson &amp; Johnson's COVID-19 vaccine, the first time such a direct link has been made in the country.  http",1
1641,Petition: Remove indemnity from the manufacturers of covid-19 vaccines  http,2
1642,@user @user @user There is also this but we cannot discuss it further. All I can say is that covid-19 vaccines are safe and effective and you should talk to your doctor about them.  http,2
1643,"2/2… spouse of Faucci truoble,for the emails of NI of Health’s chief of the Clinical Center’s Dept of Bioethics Christine Grady referencing the COVID-19 vaccine$ antibody enhancement. Grady is the spouse of Dr. Anthony Fauci, DIN Institute of Allergy &amp; Infectious Diseases.",2
1644,Novavax Inc on Monday cut its full-year revenue forecast after the company sold fewer doses of its COVID-19 vaccine in the second quarter.  http,2
1645,Everyone ages 6 months and older should get a #COVID #vaccine for protection against the worst outcomes of COVID-19. Learn more at  http and find a vaccine provider at  http #WeCanDoThis #VaccinesWork,1
1646,The European Medicines Agency is recommending Novavax's #Covid-19 #vaccine carry a warning of the possibility of two types of heart inflammation #EMA  http,2
1647,COVID-19 Vaccines are a National Emergency. #NationalEmergency #StoptheShots,2
1648,Covid-19: Rwanda rolls out fourth vaccine jab | The New Times  http ... consider a second booster dose to moderately and severely immunocompromised individuals aged 5 years and above and their close contacts.,0
1649,"The so-called bivalent vaccine combines ingredients used for existing COVID-19 shots and those derived from the BA.1 subtype of the Omicron variant, and is expected to curb the spread of the BA.5 subvariant currently prevalent across the country.",1
1650,"As of 4pm today, Cambridge is reporting: 32 newly reported COVID-19 cases. 0 newly reported COVID-19 deaths. 20.3 cases per 100,000 residents, 7-day moving average. 90% of residents with at least one vaccine dose and 73% fully vaccinated. More at  http #CambMA  http",0
1651,@user @user Vaksinasi sukses besar ketika semua yang di vaksin tak ada satu pun yang tertular lagi  Vaccine COVID-19 telah gagal melindungi tubuh para vaksinator,2
1652,@user Did you in the past agree that previous vaccines for other diseases 100% worked and should be prioritised over all other measures? Or are you now only changing your stance based on the results of poor Covid 19 vaccine efficacy?,0
1653,Covid: A tale of two stories ⤵️  🔻Moderna Profit Falls Amid Charges for Unused Covid-19 Vaccines  http  🔺Eli Lilly’s Covid-19 Antibody Treatment to Be Sold Commercially  http #prevention #health #news #pandemic #patientcare,2
1654,"@user Wow what a lie! Theses are jobs that the Covid 19 vaccine shut down our economy. Theses are not new jobs.Its just businesses that had to close there doors ,because of Democrats governors. Keep drinking the Democ(rats koolaid.",0
1655,At this point you are a fool for taking the  #Covid_19 vaccine and it’s boosters.  Trusting the #USGovernment was the first mistake. Start listening to facts.,0
1656,"At Fourth Pillar, we are big @user fans - so congratulations Dolly on being amongst the @user of Philanthropists recipients for your funding of COVID-19 vaccine research #philanthropy #countrymusic 🤠",1
1657,"@user So boosters aren’t too effective against #omicron, data is not complete! So what is the excuse for not rolling out #evusheld4theuk now?    “COVID-19 vaccines are effective at preventing serious illness and death, experts say”   http",2
1658,"Cominarty, (the marketing name for the Pfizer-BioNTech COVID-19 Vaccine), has only been granted approval on the basis of further trials. Therefore NOT fully approved now. Still EUA.   The mainstream media misled the public with the omission of important facts and slight of hand.",0
1659,The Covid-19 vaccine is what???? 🧐🤔#JustSayNoToDrugs 💉🦂🐍🚫🚫🚫   http,2
1660,Myanmar (Burma)  http This travel advice has been reviewed in full with editorial amendments throughout.  Updated information on acceptable vaccines and new COVID-19 procedures  ('Entry requirements' and 'Coronavirus' pages),0
1661,The next Republican POTUS needs to pull any/all COVID-19 emergency use authorizations for vaccines and medications on day one in office.,1
1662,Learn more about the COVID-19 vaccine for infants and preschoolers  http  http,1
1663,"The Department of Health (DoH) on Tuesday announced that all expired COVID-19 vaccines, including those procured by the private sector, will be replaced by the COVAX facility.  Full story:  http",0
1664,@user @user @user @user So why does 99% of the scientific community agree the vaccines are safe and effective and covid-19 is indeed a big deal?,1
1665,Talk about it: #health #canada #vaccine Pfizer's COVID-19 mRNA Product is 13-Times Less Effective @ Preventing Infection With SARS-CoV-2 than Naturally Acquired Immunity! More People Must Start Listening to Scientists Who Are Actually Following the Science  http,2
1666,@user @user @user Thank you for proving my point... A COVID-19 vaccine can prevent UR child from getting COVID-19 &amp;  spreading it @ hom &amp; in school. A vax could prevent severe illness. It can also help keep your child in school &amp; safely have plydats &amp; participate in sports &amp; other group activities,2
1667,COVID-19 vaccines saved an estimated 20 million lives in 1 year | CIDRAP  http,1
1668,@user @user The blood clotting is undeniable the vaccines cause blood clotting. Dr Peter McCullough. National Clinical Director Jason Leitch Why does the so called safe &amp; effective COVID-19 (toxic injections) vaccines cause blood clotting?,2
1669,DOH officer-in-charge Maria Rosario Vergeire said the country’s Covid-19 vaccine wastage is less than the 10 percent threshold set by the World Health Organization.   http,0
1670,Nauna nang sinabi ni dating Presidential Adviser for Entrepreneurship Joey Concepcion na na-expire ang P5.1 bilyong halaga ng COVID-19 vaccines na nasa pribadong sektor dahil huli na ang pagpapalabas ng guidelines ng DOH para ipamahagi ang second booster. | via Danilo Garcia  http,1
1671,"Now that elimination is over, are we just going to see all those lives we saved be taken anyways? No. Vaccines and treatments now mean elimination didn't just defer Covid-19 deaths but averted them entirely.",0
1672,"@user Oh please, the lockdowns didn't save anyone, the masks were useless, and the COVID-19 vaccine barely makes a difference. It also has potential side effects that can be really serious, if not deadly.  And now, thanks to the lockdowns and Biden, we're in a recession. 🖕",2
1673,"$PFE is close to acquiring Global Blood Therapeutics for about $5bn as the drugmaker taps the huge cash pile generated by the success of its Covid-19 vaccine to replenish its pipeline, according to people briefed on the talks.",1
1674,"Yes, COVID-19 vaccine boosters for omicron will be available to the public in 2022  http",2
1675,5 Facts to Consider Before Vaccinating Kids for COVID #Covid_19 #COVID19 #vaccine #VaccineDeaths #vaccines #coronavirus #coronavaccination #coronavaccine   http,1
1676,"@user @user If the Covid-19 vaccines worked, why are we still having rising cases and hospitalizations? Why are triple vaxxed people still being placed into the ICU? Especially when Canada is over 91% double vaccinated… read the Pfizer study in particular and you’ll see the data.",1
1677,Adolescent COVID-19 vaccine study ‘very encouraging’ for hesitant parents  http,1
1678,"mRNA Vaccine Fighting Covid Sold As An NFT For $226,800  The University of Pennsylvania has just sold an NFT of an mRNA vaccine fighting the Covid 19 virus for $226,800. This one-of-a-kind NFT is a remarkable combination of smart contract technology an  http",1
1679," http ""COVID-19 Boosters This Fall to Include Omicron Antigen, but Questions Remain About Its Value"" However, if NO new immune evading mechanism of BA5 over that of BA1, NO good reason why a more antigenically matched vaccine may not help to reduce immune escape",1
1680,Do you have questions about COVID-19 and vaccines? WhatsApp a doctor on 060 019 0000 for more information #KeReady #IChooseVaccination  http,0
1681,#bullshit EXCLUSIVE: CDC Claims Link Between Heart Inflammation and COVID-19 Vaccines Wasn’t Known for Most of 2021   http,0
1682,"To find more information about free, safe and effective COVID-19 vaccines, visit:  http",2
1683,"Sen. Risa Hontiveros on Wednesday called for a Senate investigation of the looming wastage of up to P13.5 billion worth of unused and expired COVID-19 vaccines, while the number of infections continued to rise.  via Inquirer Mobile:  http",1
1684,"There were so many jokes during the Covid 19 pandemic but the biggest was M7 and Musenero promising Ugandans a vaccine.They even bought rats at 8million each,now they think we forgot naye Ugs can't forgot 😀😀😀",0
1685,"I ain’t the smartest man in the world. But, what if the COVID-19 vaccine had some shit in it that made it more of a possibility for someone to get monkeypox?",0
1686,"💉 Vaccines  58.59% of the total county population had at least 1 dose (128,427 people — up 78).  Of those:  ▶︎ 4.75% are partially vaccinated (10,415 people — up 8) ▶︎ 53.84% are fully vaccinated (118,012 people — up 70) ▶︎ 30.2% are boosted (66,187 people — up 120)",2
1687,"@user @user @user @user C'est écrit noir sur blanc tu peux lire?  ""The AESI terms... Include events of interest due to their association with severe covid-19 and events of interest for vaccines in general""  J'affirme parce que c'est écrit sur le même document que tu m'as toi même montré",1
1688,Covid-19 came from Chyyyyna and the vaccines do not work.,0
1689,Todos los niños y niñas deben recibir sus vacunaciones y refuerzos contra el COVID-19 antes de regresar a la escuela este mes. | Children should get up to date with their COVID-19 vaccines including boosters when eligible before returning to school this month.  http,2
1690,#BantayBakuna: @user kinumpirma na naghain ng application sa @user ang COVID-19 vaccine manufacturer na Janssen ng kumpanyang Johnson &amp; Johnson para mabigyan ng Certificate of Product Registration. | via @user  http,1
1691,Health Care Workers Who Sued Over COVID-19 Vaccine Mandate Win $10 Million Settlement  http,2
1692,"@user @user I usually have this little routine pre COVID-19 vaccine. It may make little to no difference, but I avoid my usual caffeine, drink a tonne of water &amp; some hydralyte, eat anti-inflammatory food &amp; rest. Do nothing strenuous. Any reactions I've had have been ""mild"" &amp; resolve quick.",1
1693,Twitter Threatened With Class-Action Lawsuit for Banning Doctor Over COVID-19 Vaccine Post  http,0
1694,Covid 19 vaccines are not safe. Too many people have died from getting the vaccine.,0
1695,Covid-19 vaccine is a misnomer. It's not a vaccine,0
1696,COVID-19 vaccines to be offered to to vulnerable children between six months and five years old  http via @user,1
1697,Information About Johnson &amp; Johnson’s Janssen COVID-19 Vaccine  http,2
1698,@user Fckn Bell boy haha  http,1
1699,COVID-19 update – Saturday 6 August 2022  In the 24-hour reporting period to 4pm yesterday:   - 96.8% of people aged 16+ have had one dose of a COVID-19 vaccine* - 95.3% of people aged 16+ have had two doses of a COVID-19 vaccine*  http,2
1700,"In the US, Operation Warp Speed and the Defense Production Act helped make hundreds of millions of COVID-19 vaccine doses available by early 2021. Amazing!  But then a puzzle emerged. Why did Pfizer and Moderna stop expanding their US-based capacity?  Me 👉 http  http",2
1701,Misrepresentation of Germany’s Data on Unverified COVID-19 Vaccine Side Effects  http,0
1702,"@user @user Maybe. Then,Trump refused to insure a smooth transition from HIS administration to Biden’s.  Trump refused to share any progress he had made with the pharmaceutical companies to develop vaccines for Covid-19. Biden had to start at square  one.  Over 250,000 died on Trump’s watch.",0
1703,@user 🚩 False. There is a vaccine for Covid-19. It is now a mild (and unavoidable) respiratory illness. Resume your normal lives and forget about it.,0
1704,"Vaccine Clinic in Wasaga Beach @user Staying up to date with all COVID-19 vaccine doses you are eligible for remains the best defence against infection, severe illness, long-term COVID-19 symptoms, hospitalization and death. Learn more @user   http  http",2
1705,"Has your child recently received an immunization?  Young children should wait 14 days before or after the administration of another vaccine before getting their COVID-19 vaccine.  When they are eligible, book an appointment for them here:  http  http",1
1706,A study out of the United Kingdom has shown that health care workers who received multiple COVID-19 vaccine boosters after initially being infected with the original virus strain from Wuhan are more prone to chronic reinfection from the Omicron variant.  http,2
1707,South Africa Confirms First Death ‘Causally Linked’ to COVID-19 Vaccine • Children's Health Defense  http,1
1708,Petition: Remove indemnity from the manufacturers of covid-19 vaccines  http,2
1709,"@user @user @user One, the NEVER said you would not get COVID-19 if you had the vaccine.  They said your chances of surviving went way up. That was your first misrepresentation.",0
1710,@user Marked free from Covid 19 vaccine injury!!!!,2
1711,@user @user 😆 Your preprint states..  “The placebo controlled RCTs of COVID-19 vaccines were halted rapidly due to clear effects on COVID-19 infections”.   ie..  non vaxxed did **dramatically worse**,1
1712,"Stand-up comedy—historically known for pushing boundaries—faces a clash in cultural taboos around subjects such as COVID vaccines, gender ideology, and race. Before COVID-19, a rebellious instinct wasa factor that lead some comedians to achieve  # # #   http  http",0
1713,"@user @user What's despicable is people like you that blindly follow .The vaccines are not safe. How many more have to die before this is clear? And why do you people say nothing about the flu vaccin which kill hundreds of thousands a year? Or used to, before everything was labeled COVID 19?",0
1714,COVID-19 update – Tuesday 9 August 2022  In the 24-hour reporting period to 4pm yesterday:   - 96.9% of people aged 16+ have had one dose of a COVID-19 vaccine* - 95.3% of people aged 16+ have had two doses of a COVID-19 vaccine*  http,2
1715,"Worth stressing that Prasad argued against COVID-19 vaccine EUA for the 12-15, not just &lt;5",0
1716,Misrepresentation of Germany’s Data on Unverified COVID-19 Vaccine Side Effects  http,0
1717,@user @user @user @user This is only about the COVID-19 vaccine dude. You're terrible,2
1718,@user But what will happen if they don't take it well forces on them will take their rights away from them if they do not take it they cannot go to work ok would call it covid-19 we have complete lockdown until they take the vaccine,1
1719,@user He literally discovered the effectiveness of the COVID-19 vaccine via doing his own research. How could you not be a fan of a big brain like that?!,2
1720,"To illustrate the severity of infections, Fig 1 shows COVID-19 Hospitalizations and Deaths in 2020 (before vaccines + onsite school closures), in 2021 (with vaccines for adolescents + onsite school reopening), and in 2022 (with delayed vaccine rollout) in the first 22 epiweeks.4/  http",1
1721,Major Israeli study: COVID death rate among elderly slashed by 72% after 4th vaccine   The fourth shot of Pfizer’s vaccine slashed the chance of hospitalization for COVID by over 60% and delivered a 34% reduction in chances of infection  http,0
1722,I voted for Not a chance. Too many unknowns about risks/side effects - Poll: Should kids (aged 6 months to 5 years old) be getting the COVID-19 vaccine?  http,0
1723,"UK Medicine Regulator Confirms COVID-19 Vaccines are 7,402% Deadlier than all other Vaccines Combined  http",0
1724,The UK's medical regulator has confirmed that the Covid-19 vaccine has killed at least 5.5 times more people in 19 months than all other available vaccines combined over the past 21 years.   http,1
1725,"Novavax's COVID-19 vaccine rollout off to sluggish start with just 7,000 doses in arms  http van Katwijk/Getty Images(NEW YORK) -- Following its emergency authorization last month, just 7,300 doses of Novavax's COVID-19 vaccine have been administered to Ameri...",0
1726,@user @user More boosters,1
